Subject,Body,Link,Sender,ID
Join us live on launch day: Discover what's new with v0,"Join members of the v0 team on October 15 for a live demo of the latest v0 feature releases.В   В В Live from launch day:Discover what's new with v0В В On October 15 we will be releasing exciting updates to v0.Join members of the v0 team on October 15 at 2:00pm ET |В  11:00am PT for a live demo of the latest v0 feature releases.During the session, you'll:Learn how VercelвҖҷs AI-powered tool, v0, can elevate your teamвҖҷs capabilitiesBe the first to see new features releasedParticipate in live Q&AВ В Register now В В CanвҖҷt join live? Register to receive the recording in your inbox.В В В В В  В     В Talk to a Vercel expert вҶ’Docs | Blog | Contact | Careers 440 N Barranca Ave #4133 Covina, CA 91723Copyright В© 2024 Vercel Inc. All rights reserved.View our Privacy Policy or unsubscribe.В  ",https://outlook.office365.com/owa/?ItemID=AAMkAGY5Y2ZkY2U1LTZkMDAtNDdmMS1iN2YyLWRkYmRhYjljMGIyZQBGAAAAAAA1acH4l31PT5bYjWIdT7j8BwD0di2GbE5eQLmNvaC7hxKrAAAAAAEMAAD0di2GbE5eQLmNvaC7hxKrAALbsEWtAAA%3D&exvsurl=1&viewmodel=ReadMessageItem,ship@info.vercel.com,AAMkAGY5Y2ZkY2U1LTZkMDAtNDdmMS1iN2YyLWRkYmRhYjljMGIyZQBGAAAAAAA1acH4l31PT5bYjWIdT7j8BwD0di2GbE5eQLmNvaC7hxKrAAAAAAEMAAD0di2GbE5eQLmNvaC7hxKrAALbsEWtAAA=
"Aman, your profile has been viewed рҹ‘Җ","Get direct interview calls from our top hiring companies. вҖҢВ вҖҢВ вҖҢВ вҖҢВ вҖҢВ вҖҢВ вҖҢВ вҖҢВ вҖҢВ вҖҢВ вҖҢВ вҖҢВ вҖҢВ вҖҢВ вҖҢВ вҖҢВ вҖҢВ вҖҢВ вҖҢВ вҖҢВ вҖҢВ вҖҢВ вҖҢВ вҖҢВ вҖҢВ вҖҢВ вҖҢВ вҖҢВ вҖҢВ вҖҢВ вҖҢВ вҖҢВ вҖҢВ вҖҢВ вҖҢВ вҖҢВ вҖҢВ вҖҢВ вҖҢВ вҖҢВ вҖҢВ вҖҢВ вҖҢВ вҖҢВ вҖҢВ вҖҢВ вҖҢВ вҖҢВ вҖҢВ вҖҢВ вҖҢВ вҖҢВ вҖҢВ вҖҢВ вҖҢВ вҖҢВ вҖҢВ вҖҢВ вҖҢВ вҖҢВ вҖҢВ вҖҢВ вҖҢВ вҖҢВ вҖҢВ вҖҢВ вҖҢВ вҖҢВ вҖҢВ вҖҢВ  вҖҢВ вҖҢВ вҖҢВ вҖҢВ вҖҢВ вҖҢВ вҖҢВ вҖҢВ вҖҢВ вҖҢВ вҖҢВ вҖҢВ вҖҢВ вҖҢВ вҖҢВ вҖҢВ вҖҢВ вҖҢВ вҖҢВ вҖҢВ вҖҢВ вҖҢВ вҖҢВ вҖҢВ вҖҢВ вҖҢВ вҖҢВ вҖҢВ вҖҢВ вҖҢВ вҖҢВ вҖҢВ вҖҢВ вҖҢВ вҖҢВ вҖҢВ вҖҢВ вҖҢВ вҖҢВ вҖҢВ вҖҢВ вҖҢВ вҖҢВ вҖҢВ вҖҢВ вҖҢВ вҖҢВ вҖҢВ вҖҢВ вҖҢВ вҖҢВ вҖҢВ вҖҢВ вҖҢВ вҖҢВ вҖҢВ вҖҢВ вҖҢВ вҖҢВ вҖҢВ вҖҢВ вҖҢВ вҖҢВ вҖҢВ вҖҢВ вҖҢВ вҖҢВ вҖҢВ вҖҢВ вҖҢВ  вҖҢВ вҖҢВ вҖҢВ вҖҢВ вҖҢВ вҖҢВ вҖҢВ вҖҢВ вҖҢВ вҖҢВ вҖҢВ вҖҢВ вҖҢВ вҖҢВ вҖҢВ вҖҢВ вҖҢВ вҖҢВ вҖҢВ вҖҢВ вҖҢВ вҖҢВ вҖҢВ вҖҢВ вҖҢВ вҖҢВ вҖҢВ вҖҢВ вҖҢВ вҖҢВ вҖҢВ вҖҢВ вҖҢВ вҖҢВ вҖҢВ вҖҢВ вҖҢВ вҖҢВ вҖҢВ вҖҢВ вҖҢВ вҖҢВ вҖҢВ вҖҢВ вҖҢВ вҖҢВ вҖҢВ вҖҢВ вҖҢВ вҖҢВ вҖҢВ вҖҢВ вҖҢВ вҖҢВ вҖҢВ вҖҢВ вҖҢВ вҖҢВ вҖҢВ вҖҢВ вҖҢВ вҖҢВ вҖҢВ вҖҢВ вҖҢВ вҖҢВ вҖҢВ вҖҢВ вҖҢВ вҖҢВ  вҖҢВ вҖҢВ вҖҢВ вҖҢВ вҖҢВ вҖҢВ вҖҢВ вҖҢВ вҖҢВ вҖҢВ вҖҢВ вҖҢВ вҖҢВ вҖҢВ вҖҢВ вҖҢВ вҖҢВ вҖҢВ вҖҢВ вҖҢВ вҖҢВ вҖҢВ вҖҢВ вҖҢВ вҖҢВ вҖҢВ вҖҢВ вҖҢВ вҖҢВ вҖҢВ вҖҢВ вҖҢВ вҖҢВ вҖҢВ вҖҢВ вҖҢВ вҖҢВ вҖҢВ вҖҢВ вҖҢВ вҖҢВ вҖҢВ вҖҢВ вҖҢВ вҖҢВ вҖҢВ вҖҢВ вҖҢВ вҖҢВ вҖҢВ вҖҢВ вҖҢВ вҖҢВ вҖҢВ вҖҢВ вҖҢВ вҖҢВ вҖҢВ вҖҢВ вҖҢВ вҖҢВ вҖҢВ вҖҢВ вҖҢВ вҖҢВ вҖҢВ вҖҢВ вҖҢВ вҖҢВ вҖҢВ  вҖҢВ вҖҢВ вҖҢВ вҖҢВ вҖҢВ вҖҢВ вҖҢВ вҖҢВ вҖҢВ вҖҢВ вҖҢВ вҖҢВ вҖҢВ вҖҢВ вҖҢВ вҖҢВ вҖҢВ вҖҢВ вҖҢВ вҖҢВ вҖҢВ вҖҢВ вҖҢВ вҖҢВ вҖҢВ вҖҢВ вҖҢВ вҖҢВ вҖҢВ вҖҢВ вҖҢВ вҖҢВ вҖҢВ вҖҢВ вҖҢВ вҖҢВ вҖҢВ вҖҢВ вҖҢВ вҖҢВ вҖҢВ вҖҢВ вҖҢВ вҖҢВ вҖҢВ вҖҢВ вҖҢВ вҖҢВ вҖҢВ вҖҢВ вҖҢВ вҖҢВ вҖҢВ вҖҢВ вҖҢВ вҖҢВ вҖҢВ вҖҢВ вҖҢВ вҖҢВ вҖҢВ вҖҢВ вҖҢВ вҖҢВ вҖҢВ вҖҢВ вҖҢВ вҖҢВ вҖҢВ вҖҢВ  вҖҢВ вҖҢВ вҖҢВ вҖҢВ вҖҢВ вҖҢВ вҖҢВ вҖҢВ вҖҢВ вҖҢВ вҖҢВ вҖҢВ вҖҢВ вҖҢВ вҖҢВ вҖҢВ вҖҢВ вҖҢВ вҖҢВ вҖҢВ вҖҢВ вҖҢВ вҖҢВ вҖҢВ вҖҢВ вҖҢВ вҖҢВ вҖҢВ вҖҢВ вҖҢВ вҖҢВ вҖҢВ вҖҢВ вҖҢВ вҖҢВ вҖҢВ вҖҢВ вҖҢВ вҖҢВ вҖҢВ вҖҢВ вҖҢВ вҖҢВ вҖҢВ вҖҢВ вҖҢВ вҖҢВ вҖҢВ вҖҢВ вҖҢВ вҖҢВ вҖҢВ вҖҢВ вҖҢВ вҖҢВ вҖҢВ вҖҢВ вҖҢВ вҖҢВ вҖҢВ вҖҢВ вҖҢВ вҖҢВ вҖҢВ вҖҢВ вҖҢВ вҖҢВ вҖҢВ вҖҢВ вҖҢВ  вҖҢВ вҖҢВ вҖҢВ вҖҢВ вҖҢВ вҖҢВ вҖҢВ вҖҢВ вҖҢВ вҖҢВ вҖҢВ вҖҢВ вҖҢВ вҖҢВ вҖҢВ вҖҢВ вҖҢВ вҖҢВ вҖҢВ вҖҢВ вҖҢВ вҖҢВ вҖҢВ вҖҢВ вҖҢВ вҖҢВ вҖҢВ вҖҢВ вҖҢВ вҖҢВ вҖҢВ вҖҢВ вҖҢВ вҖҢВ вҖҢВ вҖҢВ вҖҢВ вҖҢВ вҖҢВ вҖҢВ вҖҢВ вҖҢВ вҖҢВ вҖҢВ вҖҢВ вҖҢВ вҖҢВ вҖҢВ вҖҢВ вҖҢВ вҖҢВ вҖҢВ вҖҢВ вҖҢВ вҖҢВ вҖҢВ вҖҢВ вҖҢВ вҖҢВ вҖҢВ вҖҢВ вҖҢВ вҖҢВ вҖҢВ вҖҢВ вҖҢВ вҖҢВ вҖҢВ вҖҢВ вҖҢВ  Aman, confirm a successful start to your career in 2024 with this free placement preparation course! Offer expiring soon! В вҖҢВ вҖҢВ вҖҢВ вҖҢВ вҖҢВ вҖҢВ вҖҢВ вҖҢВ вҖҢВ вҖҢВ  В вҖҢВ вҖҢВ вҖҢВ вҖҢВ вҖҢВ вҖҢВ вҖҢВ вҖҢВ вҖҢВ вҖҢВ  В вҖҢВ вҖҢВ вҖҢВ вҖҢВ вҖҢВ вҖҢВ вҖҢВ вҖҢВ вҖҢВ вҖҢВ  В вҖҢВ вҖҢВ вҖҢВ вҖҢВ вҖҢВ вҖҢВ вҖҢВ вҖҢВ вҖҢВ вҖҢВ  В вҖҢВ вҖҢВ вҖҢВ вҖҢВ вҖҢВ вҖҢВ вҖҢВ вҖҢВ вҖҢВ вҖҢВ  В вҖҢВ вҖҢВ вҖҢВ вҖҢВ вҖҢВ вҖҢВ вҖҢВ вҖҢВ вҖҢВ вҖҢВ  В вҖҢВ вҖҢВ вҖҢВ вҖҢВ вҖҢВ вҖҢВ вҖҢВ вҖҢВ вҖҢВ вҖҢВ  В вҖҢВ вҖҢВ вҖҢВ вҖҢВ вҖҢВ вҖҢВ вҖҢВ вҖҢВ вҖҢВ вҖҢВ  В вҖҢВ вҖҢВ вҖҢВ вҖҢВ вҖҢВ вҖҢВ вҖҢВ вҖҢВ вҖҢВ вҖҢВ  В вҖҢВ вҖҢВ вҖҢВ вҖҢВ вҖҢВ вҖҢВ вҖҢВ вҖҢВ вҖҢВ вҖҢВ    Internshala (Scholiverse Educare Pvt. Ltd.) 901 A/B, Iris Tech Park, Sohna Road, Sector 48, GurugramNot keen on career commitments? Unsubscribe here to break up with us.  ",https://outlook.office365.com/owa/?ItemID=AAMkAGY5Y2ZkY2U1LTZkMDAtNDdmMS1iN2YyLWRkYmRhYjljMGIyZQBGAAAAAAA1acH4l31PT5bYjWIdT7j8BwD0di2GbE5eQLmNvaC7hxKrAAAAAAEMAAD0di2GbE5eQLmNvaC7hxKrAALbsEWsAAA%3D&exvsurl=1&viewmodel=ReadMessageItem,jos@internshala.com,AAMkAGY5Y2ZkY2U1LTZkMDAtNDdmMS1iN2YyLWRkYmRhYjljMGIyZQBGAAAAAAA1acH4l31PT5bYjWIdT7j8BwD0di2GbE5eQLmNvaC7hxKrAAAAAAEMAAD0di2GbE5eQLmNvaC7hxKrAALbsEWsAAA=
"Aman, your profile has been viewed рҹ‘Җ","Get direct interview calls from our top hiring companies. вҖҢВ вҖҢВ вҖҢВ вҖҢВ вҖҢВ вҖҢВ вҖҢВ вҖҢВ вҖҢВ вҖҢВ вҖҢВ вҖҢВ вҖҢВ вҖҢВ вҖҢВ вҖҢВ вҖҢВ вҖҢВ вҖҢВ вҖҢВ вҖҢВ вҖҢВ вҖҢВ вҖҢВ вҖҢВ вҖҢВ вҖҢВ вҖҢВ вҖҢВ вҖҢВ вҖҢВ вҖҢВ вҖҢВ вҖҢВ вҖҢВ вҖҢВ вҖҢВ вҖҢВ вҖҢВ вҖҢВ вҖҢВ вҖҢВ вҖҢВ вҖҢВ вҖҢВ вҖҢВ вҖҢВ вҖҢВ вҖҢВ вҖҢВ вҖҢВ вҖҢВ вҖҢВ вҖҢВ вҖҢВ вҖҢВ вҖҢВ вҖҢВ вҖҢВ вҖҢВ вҖҢВ вҖҢВ вҖҢВ вҖҢВ вҖҢВ вҖҢВ вҖҢВ вҖҢВ вҖҢВ вҖҢВ  вҖҢВ вҖҢВ вҖҢВ вҖҢВ вҖҢВ вҖҢВ вҖҢВ вҖҢВ вҖҢВ вҖҢВ вҖҢВ вҖҢВ вҖҢВ вҖҢВ вҖҢВ вҖҢВ вҖҢВ вҖҢВ вҖҢВ вҖҢВ вҖҢВ вҖҢВ вҖҢВ вҖҢВ вҖҢВ вҖҢВ вҖҢВ вҖҢВ вҖҢВ вҖҢВ вҖҢВ вҖҢВ вҖҢВ вҖҢВ вҖҢВ вҖҢВ вҖҢВ вҖҢВ вҖҢВ вҖҢВ вҖҢВ вҖҢВ вҖҢВ вҖҢВ вҖҢВ вҖҢВ вҖҢВ вҖҢВ вҖҢВ вҖҢВ вҖҢВ вҖҢВ вҖҢВ вҖҢВ вҖҢВ вҖҢВ вҖҢВ вҖҢВ вҖҢВ вҖҢВ вҖҢВ вҖҢВ вҖҢВ вҖҢВ вҖҢВ вҖҢВ вҖҢВ вҖҢВ вҖҢВ вҖҢВ  вҖҢВ вҖҢВ вҖҢВ вҖҢВ вҖҢВ вҖҢВ вҖҢВ вҖҢВ вҖҢВ вҖҢВ вҖҢВ вҖҢВ вҖҢВ вҖҢВ вҖҢВ вҖҢВ вҖҢВ вҖҢВ вҖҢВ вҖҢВ вҖҢВ вҖҢВ вҖҢВ вҖҢВ вҖҢВ вҖҢВ вҖҢВ вҖҢВ вҖҢВ вҖҢВ вҖҢВ вҖҢВ вҖҢВ вҖҢВ вҖҢВ вҖҢВ вҖҢВ вҖҢВ вҖҢВ вҖҢВ вҖҢВ вҖҢВ вҖҢВ вҖҢВ вҖҢВ вҖҢВ вҖҢВ вҖҢВ вҖҢВ вҖҢВ вҖҢВ вҖҢВ вҖҢВ вҖҢВ вҖҢВ вҖҢВ вҖҢВ вҖҢВ вҖҢВ вҖҢВ вҖҢВ вҖҢВ вҖҢВ вҖҢВ вҖҢВ вҖҢВ вҖҢВ вҖҢВ вҖҢВ вҖҢВ  вҖҢВ вҖҢВ вҖҢВ вҖҢВ вҖҢВ вҖҢВ вҖҢВ вҖҢВ вҖҢВ вҖҢВ вҖҢВ вҖҢВ вҖҢВ вҖҢВ вҖҢВ вҖҢВ вҖҢВ вҖҢВ вҖҢВ вҖҢВ вҖҢВ вҖҢВ вҖҢВ вҖҢВ вҖҢВ вҖҢВ вҖҢВ вҖҢВ вҖҢВ вҖҢВ вҖҢВ вҖҢВ вҖҢВ вҖҢВ вҖҢВ вҖҢВ вҖҢВ вҖҢВ вҖҢВ вҖҢВ вҖҢВ вҖҢВ вҖҢВ вҖҢВ вҖҢВ вҖҢВ вҖҢВ вҖҢВ вҖҢВ вҖҢВ вҖҢВ вҖҢВ вҖҢВ вҖҢВ вҖҢВ вҖҢВ вҖҢВ вҖҢВ вҖҢВ вҖҢВ вҖҢВ вҖҢВ вҖҢВ вҖҢВ вҖҢВ вҖҢВ вҖҢВ вҖҢВ вҖҢВ вҖҢВ  вҖҢВ вҖҢВ вҖҢВ вҖҢВ вҖҢВ вҖҢВ вҖҢВ вҖҢВ вҖҢВ вҖҢВ вҖҢВ вҖҢВ вҖҢВ вҖҢВ вҖҢВ вҖҢВ вҖҢВ вҖҢВ вҖҢВ вҖҢВ вҖҢВ вҖҢВ вҖҢВ вҖҢВ вҖҢВ вҖҢВ вҖҢВ вҖҢВ вҖҢВ вҖҢВ вҖҢВ вҖҢВ вҖҢВ вҖҢВ вҖҢВ вҖҢВ вҖҢВ вҖҢВ вҖҢВ вҖҢВ вҖҢВ вҖҢВ вҖҢВ вҖҢВ вҖҢВ вҖҢВ вҖҢВ вҖҢВ вҖҢВ вҖҢВ вҖҢВ вҖҢВ вҖҢВ вҖҢВ вҖҢВ вҖҢВ вҖҢВ вҖҢВ вҖҢВ вҖҢВ вҖҢВ вҖҢВ вҖҢВ вҖҢВ вҖҢВ вҖҢВ вҖҢВ вҖҢВ вҖҢВ вҖҢВ  вҖҢВ вҖҢВ вҖҢВ вҖҢВ вҖҢВ вҖҢВ вҖҢВ вҖҢВ вҖҢВ вҖҢВ вҖҢВ вҖҢВ вҖҢВ вҖҢВ вҖҢВ вҖҢВ вҖҢВ вҖҢВ вҖҢВ вҖҢВ вҖҢВ вҖҢВ вҖҢВ вҖҢВ вҖҢВ вҖҢВ вҖҢВ вҖҢВ вҖҢВ вҖҢВ вҖҢВ вҖҢВ вҖҢВ вҖҢВ вҖҢВ вҖҢВ вҖҢВ вҖҢВ вҖҢВ вҖҢВ вҖҢВ вҖҢВ вҖҢВ вҖҢВ вҖҢВ вҖҢВ вҖҢВ вҖҢВ вҖҢВ вҖҢВ вҖҢВ вҖҢВ вҖҢВ вҖҢВ вҖҢВ вҖҢВ вҖҢВ вҖҢВ вҖҢВ вҖҢВ вҖҢВ вҖҢВ вҖҢВ вҖҢВ вҖҢВ вҖҢВ вҖҢВ вҖҢВ вҖҢВ вҖҢВ  вҖҢВ вҖҢВ вҖҢВ вҖҢВ вҖҢВ вҖҢВ вҖҢВ вҖҢВ вҖҢВ вҖҢВ вҖҢВ вҖҢВ вҖҢВ вҖҢВ вҖҢВ вҖҢВ вҖҢВ вҖҢВ вҖҢВ вҖҢВ вҖҢВ вҖҢВ вҖҢВ вҖҢВ вҖҢВ вҖҢВ вҖҢВ вҖҢВ вҖҢВ вҖҢВ вҖҢВ вҖҢВ вҖҢВ вҖҢВ вҖҢВ вҖҢВ вҖҢВ вҖҢВ вҖҢВ вҖҢВ вҖҢВ вҖҢВ вҖҢВ вҖҢВ вҖҢВ вҖҢВ вҖҢВ вҖҢВ вҖҢВ вҖҢВ вҖҢВ вҖҢВ вҖҢВ вҖҢВ вҖҢВ вҖҢВ вҖҢВ вҖҢВ вҖҢВ вҖҢВ вҖҢВ вҖҢВ вҖҢВ вҖҢВ вҖҢВ вҖҢВ вҖҢВ вҖҢВ вҖҢВ вҖҢВ  Aman, confirm a successful start to your career in 2024 with this free placement preparation course! Offer expiring soon! В вҖҢВ вҖҢВ вҖҢВ вҖҢВ вҖҢВ вҖҢВ вҖҢВ вҖҢВ вҖҢВ вҖҢВ  В вҖҢВ вҖҢВ вҖҢВ вҖҢВ вҖҢВ вҖҢВ вҖҢВ вҖҢВ вҖҢВ вҖҢВ  В вҖҢВ вҖҢВ вҖҢВ вҖҢВ вҖҢВ вҖҢВ вҖҢВ вҖҢВ вҖҢВ вҖҢВ  В вҖҢВ вҖҢВ вҖҢВ вҖҢВ вҖҢВ вҖҢВ вҖҢВ вҖҢВ вҖҢВ вҖҢВ  В вҖҢВ вҖҢВ вҖҢВ вҖҢВ вҖҢВ вҖҢВ вҖҢВ вҖҢВ вҖҢВ вҖҢВ  В вҖҢВ вҖҢВ вҖҢВ вҖҢВ вҖҢВ вҖҢВ вҖҢВ вҖҢВ вҖҢВ вҖҢВ  В вҖҢВ вҖҢВ вҖҢВ вҖҢВ вҖҢВ вҖҢВ вҖҢВ вҖҢВ вҖҢВ вҖҢВ  В вҖҢВ вҖҢВ вҖҢВ вҖҢВ вҖҢВ вҖҢВ вҖҢВ вҖҢВ вҖҢВ вҖҢВ  В вҖҢВ вҖҢВ вҖҢВ вҖҢВ вҖҢВ вҖҢВ вҖҢВ вҖҢВ вҖҢВ вҖҢВ  В вҖҢВ вҖҢВ вҖҢВ вҖҢВ вҖҢВ вҖҢВ вҖҢВ вҖҢВ вҖҢВ вҖҢВ    Internshala (Scholiverse Educare Pvt. Ltd.) 901 A/B, Iris Tech Park, Sohna Road, Sector 48, GurugramNot keen on career commitments? Unsubscribe here to break up with us.  ",https://outlook.office365.com/owa/?ItemID=AAMkAGY5Y2ZkY2U1LTZkMDAtNDdmMS1iN2YyLWRkYmRhYjljMGIyZQBGAAAAAAA1acH4l31PT5bYjWIdT7j8BwD0di2GbE5eQLmNvaC7hxKrAAAAAAEMAAD0di2GbE5eQLmNvaC7hxKrAALbsEWrAAA%3D&exvsurl=1&viewmodel=ReadMessageItem,jos@internshala.com,AAMkAGY5Y2ZkY2U1LTZkMDAtNDdmMS1iN2YyLWRkYmRhYjljMGIyZQBGAAAAAAA1acH4l31PT5bYjWIdT7j8BwD0di2GbE5eQLmNvaC7hxKrAAAAAAEMAAD0di2GbE5eQLmNvaC7hxKrAALbsEWrAAA=
"Request CANCELLATION: Video Appointment with Kisha Das  - YourDOST @ Fri, Oct 04, 2024 IST 18:00 PM IST IST..","Hi justhappy,Your Video Call appointment with Kisha Das is CANCELLED.Please CLICK HERE if you would like to book another appointment.Details of the cancelled appointment:Expert Name: Kisha Das Date of Appointment: Fri, Oct 04, 2024 IST Selected Time Period: -Preferred Time Slot: 18:00 PM ISTStay Healthy, Stay Motivated!Best Regards, Team YourDOST www.yourdost.comPlease note: Please keep a record of Transaction ID: 438974 for your reference.For any concerns or questions, please get in touch with our customer support at 080-47097654or email at customersupport@yourdost.com ",https://outlook.office365.com/owa/?ItemID=AAMkAGY5Y2ZkY2U1LTZkMDAtNDdmMS1iN2YyLWRkYmRhYjljMGIyZQBGAAAAAAA1acH4l31PT5bYjWIdT7j8BwD0di2GbE5eQLmNvaC7hxKrAAAAAAEMAAD0di2GbE5eQLmNvaC7hxKrAALbsEWqAAA%3D&exvsurl=1&viewmodel=ReadMessageItem,customersupport@yourdost.com,AAMkAGY5Y2ZkY2U1LTZkMDAtNDdmMS1iN2YyLWRkYmRhYjljMGIyZQBGAAAAAAA1acH4l31PT5bYjWIdT7j8BwD0di2GbE5eQLmNvaC7hxKrAAAAAAEMAAD0di2GbE5eQLmNvaC7hxKrAALbsEWqAAA=
Kisha Das sent a new message to you!,"Hi justhappy,Your expert, Kisha Das has left a message for you.sure. we can connect on some other day. Thank you for letting me know.В ...To view the complete thread, click hereRegards,Team YourDOST ",https://outlook.office365.com/owa/?ItemID=AAMkAGY5Y2ZkY2U1LTZkMDAtNDdmMS1iN2YyLWRkYmRhYjljMGIyZQBGAAAAAAA1acH4l31PT5bYjWIdT7j8BwD0di2GbE5eQLmNvaC7hxKrAAAAAAEMAAD0di2GbE5eQLmNvaC7hxKrAALbsEWpAAA%3D&exvsurl=1&viewmodel=ReadMessageItem,customersupport@yourdost.com,AAMkAGY5Y2ZkY2U1LTZkMDAtNDdmMS1iN2YyLWRkYmRhYjljMGIyZQBGAAAAAAA1acH4l31PT5bYjWIdT7j8BwD0di2GbE5eQLmNvaC7hxKrAAAAAAEMAAD0di2GbE5eQLmNvaC7hxKrAALbsEWpAAA=
Reminder: Video Appointment with Kisha Das - YourDOST @ Today 18:00 PM IST..,"Hi Justhappy,This mail is to inform you that you have Video Call appointment TODAY.Here are the appointment details:Expert Name: Kisha Das Date of Appointment: Fri, Oct 04, 2024 IST Confirmed Time Slot: 18:00 PM ISTYour session will be conducted over Video on YourDOST platform. For a better experience we recommend using our mobile app. Please join the session 5 minutes prior to the session start time. Please make sure that your internet connection has sufficient bandwidth to enable an effective video conversation.Download our app. Available on Google Play and App Store.Login to YourDOST mobile app.Click on the Join Video button in your upcoming appointment section.We hope you have a wonderful session with your expert. We are so glad to be a part of your journey to a happier and healthier life.Stay Healthy, Stay Motivated!Best Regards, Team YourDOST www.yourdost.comPlease note: Please keep a record of Transaction ID: 438974 for your reference.For any concerns or questions, please get in touch with our customer support at 080-47097654or email at customersupport@yourdost.com ",https://outlook.office365.com/owa/?ItemID=AAMkAGY5Y2ZkY2U1LTZkMDAtNDdmMS1iN2YyLWRkYmRhYjljMGIyZQBGAAAAAAA1acH4l31PT5bYjWIdT7j8BwD0di2GbE5eQLmNvaC7hxKrAAAAAAEMAAD0di2GbE5eQLmNvaC7hxKrAALbsEWoAAA%3D&exvsurl=1&viewmodel=ReadMessageItem,customersupport@yourdost.com,AAMkAGY5Y2ZkY2U1LTZkMDAtNDdmMS1iN2YyLWRkYmRhYjljMGIyZQBGAAAAAAA1acH4l31PT5bYjWIdT7j8BwD0di2GbE5eQLmNvaC7hxKrAAAAAAEMAAD0di2GbE5eQLmNvaC7hxKrAALbsEWoAAA=
