Subject,Body,Link,Sender,ID
"рҹҘі Congratulations, Aman! You're selected to apply to ISP Program","Last Chance to apply to the ISP Program вҖҢВ вҖҢВ вҖҢВ вҖҢВ вҖҢВ вҖҢВ вҖҢВ вҖҢВ вҖҢВ вҖҢВ вҖҢВ вҖҢВ вҖҢВ вҖҢВ вҖҢВ вҖҢВ вҖҢВ вҖҢВ вҖҢВ вҖҢВ вҖҢВ вҖҢВ вҖҢВ вҖҢВ вҖҢВ вҖҢВ вҖҢВ вҖҢВ вҖҢВ вҖҢВ вҖҢВ вҖҢВ вҖҢВ вҖҢВ вҖҢВ вҖҢВ вҖҢВ вҖҢВ вҖҢВ вҖҢВ вҖҢВ вҖҢВ вҖҢВ вҖҢВ вҖҢВ вҖҢВ вҖҢВ вҖҢВ вҖҢВ вҖҢВ вҖҢВ вҖҢВ вҖҢВ вҖҢВ вҖҢВ вҖҢВ вҖҢВ вҖҢВ вҖҢВ вҖҢВ вҖҢВ вҖҢВ вҖҢВ вҖҢВ вҖҢВ вҖҢВ вҖҢВ вҖҢВ вҖҢВ вҖҢВ  вҖҢВ вҖҢВ вҖҢВ вҖҢВ вҖҢВ вҖҢВ вҖҢВ вҖҢВ вҖҢВ вҖҢВ вҖҢВ вҖҢВ вҖҢВ вҖҢВ вҖҢВ вҖҢВ вҖҢВ вҖҢВ вҖҢВ вҖҢВ вҖҢВ вҖҢВ вҖҢВ вҖҢВ вҖҢВ вҖҢВ вҖҢВ вҖҢВ вҖҢВ вҖҢВ вҖҢВ вҖҢВ вҖҢВ вҖҢВ вҖҢВ вҖҢВ вҖҢВ вҖҢВ вҖҢВ вҖҢВ вҖҢВ вҖҢВ вҖҢВ вҖҢВ вҖҢВ вҖҢВ вҖҢВ вҖҢВ вҖҢВ вҖҢВ вҖҢВ вҖҢВ вҖҢВ вҖҢВ вҖҢВ вҖҢВ вҖҢВ вҖҢВ вҖҢВ вҖҢВ вҖҢВ вҖҢВ вҖҢВ вҖҢВ вҖҢВ вҖҢВ вҖҢВ вҖҢВ вҖҢВ вҖҢВ  вҖҢВ вҖҢВ вҖҢВ вҖҢВ вҖҢВ вҖҢВ вҖҢВ вҖҢВ вҖҢВ вҖҢВ вҖҢВ вҖҢВ вҖҢВ вҖҢВ вҖҢВ вҖҢВ вҖҢВ вҖҢВ вҖҢВ вҖҢВ вҖҢВ вҖҢВ вҖҢВ вҖҢВ вҖҢВ вҖҢВ вҖҢВ вҖҢВ вҖҢВ вҖҢВ вҖҢВ вҖҢВ вҖҢВ вҖҢВ вҖҢВ вҖҢВ вҖҢВ вҖҢВ вҖҢВ вҖҢВ вҖҢВ вҖҢВ вҖҢВ вҖҢВ вҖҢВ вҖҢВ вҖҢВ вҖҢВ вҖҢВ вҖҢВ вҖҢВ вҖҢВ вҖҢВ вҖҢВ вҖҢВ вҖҢВ вҖҢВ вҖҢВ вҖҢВ вҖҢВ вҖҢВ вҖҢВ вҖҢВ вҖҢВ вҖҢВ вҖҢВ вҖҢВ вҖҢВ вҖҢВ вҖҢВ  вҖҢВ вҖҢВ вҖҢВ вҖҢВ вҖҢВ вҖҢВ вҖҢВ вҖҢВ вҖҢВ вҖҢВ вҖҢВ вҖҢВ вҖҢВ вҖҢВ вҖҢВ вҖҢВ вҖҢВ вҖҢВ вҖҢВ вҖҢВ вҖҢВ вҖҢВ вҖҢВ вҖҢВ вҖҢВ вҖҢВ вҖҢВ вҖҢВ вҖҢВ вҖҢВ вҖҢВ вҖҢВ вҖҢВ вҖҢВ вҖҢВ вҖҢВ вҖҢВ вҖҢВ вҖҢВ вҖҢВ вҖҢВ вҖҢВ вҖҢВ вҖҢВ вҖҢВ вҖҢВ вҖҢВ вҖҢВ вҖҢВ вҖҢВ вҖҢВ вҖҢВ вҖҢВ вҖҢВ вҖҢВ вҖҢВ вҖҢВ вҖҢВ вҖҢВ вҖҢВ вҖҢВ вҖҢВ вҖҢВ вҖҢВ вҖҢВ вҖҢВ вҖҢВ вҖҢВ вҖҢВ вҖҢВ  вҖҢВ вҖҢВ вҖҢВ вҖҢВ вҖҢВ вҖҢВ вҖҢВ вҖҢВ вҖҢВ вҖҢВ вҖҢВ вҖҢВ вҖҢВ вҖҢВ вҖҢВ вҖҢВ вҖҢВ вҖҢВ вҖҢВ вҖҢВ вҖҢВ вҖҢВ вҖҢВ вҖҢВ вҖҢВ вҖҢВ вҖҢВ вҖҢВ вҖҢВ вҖҢВ вҖҢВ вҖҢВ вҖҢВ вҖҢВ вҖҢВ вҖҢВ вҖҢВ вҖҢВ вҖҢВ вҖҢВ вҖҢВ вҖҢВ вҖҢВ вҖҢВ вҖҢВ вҖҢВ вҖҢВ вҖҢВ вҖҢВ вҖҢВ вҖҢВ вҖҢВ вҖҢВ вҖҢВ вҖҢВ вҖҢВ вҖҢВ вҖҢВ вҖҢВ вҖҢВ вҖҢВ вҖҢВ вҖҢВ вҖҢВ вҖҢВ вҖҢВ вҖҢВ вҖҢВ вҖҢВ вҖҢВ  вҖҢВ вҖҢВ вҖҢВ вҖҢВ вҖҢВ вҖҢВ вҖҢВ вҖҢВ вҖҢВ вҖҢВ вҖҢВ вҖҢВ вҖҢВ вҖҢВ вҖҢВ вҖҢВ вҖҢВ вҖҢВ вҖҢВ вҖҢВ вҖҢВ вҖҢВ вҖҢВ вҖҢВ вҖҢВ вҖҢВ вҖҢВ вҖҢВ вҖҢВ вҖҢВ вҖҢВ вҖҢВ вҖҢВ вҖҢВ вҖҢВ вҖҢВ вҖҢВ вҖҢВ вҖҢВ вҖҢВ вҖҢВ вҖҢВ вҖҢВ вҖҢВ вҖҢВ вҖҢВ вҖҢВ вҖҢВ вҖҢВ вҖҢВ вҖҢВ вҖҢВ вҖҢВ вҖҢВ вҖҢВ вҖҢВ вҖҢВ вҖҢВ вҖҢВ вҖҢВ вҖҢВ вҖҢВ вҖҢВ вҖҢВ вҖҢВ вҖҢВ вҖҢВ вҖҢВ вҖҢВ вҖҢВ  вҖҢВ вҖҢВ вҖҢВ вҖҢВ вҖҢВ вҖҢВ вҖҢВ вҖҢВ вҖҢВ вҖҢВ вҖҢВ вҖҢВ вҖҢВ вҖҢВ вҖҢВ вҖҢВ вҖҢВ вҖҢВ вҖҢВ вҖҢВ вҖҢВ вҖҢВ вҖҢВ вҖҢВ вҖҢВ вҖҢВ вҖҢВ вҖҢВ вҖҢВ вҖҢВ вҖҢВ вҖҢВ вҖҢВ вҖҢВ вҖҢВ вҖҢВ вҖҢВ вҖҢВ вҖҢВ вҖҢВ вҖҢВ вҖҢВ вҖҢВ вҖҢВ вҖҢВ вҖҢВ вҖҢВ вҖҢВ вҖҢВ вҖҢВ вҖҢВ вҖҢВ вҖҢВ вҖҢВ вҖҢВ вҖҢВ вҖҢВ вҖҢВ вҖҢВ вҖҢВ вҖҢВ вҖҢВ вҖҢВ вҖҢВ вҖҢВ вҖҢВ вҖҢВ вҖҢВ вҖҢВ вҖҢВ  Internshala Student Partner Program Woohoo, Aman! Get ready to represent us in Bennett University Join India's #1 Student Partner Program Aman, as a college student, this is your last chance to EARN huge rewards by joining the Internshala Student Partner program while LEARNING job-necessary skills like leadership, communication & networking! Rewards? - Win MEGA Giveaways such as an iPhone 14 , Internshala Merch, Free Internshala Trainings, Netflix subscription, Free Movie Tickets and a lot more! What's more - 5+ Masterclasses & 15+ exciting online contests to win rewards worth вӮ№7 Lacs. Eligibility - B.Tech students from Bennett University can apply. Deadline - Tomorrow! Click here or on the button below to get started! APPLY NOWInternshala (Scholiverse Educare Pvt. Ltd.)901A and 901B, Iris Tech Park, Sector - 48, Sohna Road, GurugramNot keen on career commitments? Unsubscribe here to break up with us. ",https://outlook.office365.com/owa/?ItemID=AAMkAGY5Y2ZkY2U1LTZkMDAtNDdmMS1iN2YyLWRkYmRhYjljMGIyZQBGAAAAAAA1acH4l31PT5bYjWIdT7j8BwD0di2GbE5eQLmNvaC7hxKrAAAAAAEMAAD0di2GbE5eQLmNvaC7hxKrAALbsEWzAAA%3D&exvsurl=1&viewmodel=ReadMessageItem,student@internshala.com,AAMkAGY5Y2ZkY2U1LTZkMDAtNDdmMS1iN2YyLWRkYmRhYjljMGIyZQBGAAAAAAA1acH4l31PT5bYjWIdT7j8BwD0di2GbE5eQLmNvaC7hxKrAAAAAAEMAAD0di2GbE5eQLmNvaC7hxKrAALbsEWzAAA=
Internship Cum Placement opportunity || Zepto || Batch 2025,"Dear Students, В Internship + PPO opportunity at Zepto, all the eligible students are required to register on the below link:В Link : Registration LinkВ Deadline : 6th October, 2024 before 6 pm.В Details on the Requirement :В В Role:В Deputy Delivery Hub ManagerВ  В Work Location:В PAN India [Priority will be given forВ Noida/Delhi/NCRВ ]В Mandatory NO Current BACKLOGSВ Compensation:В We are offering Internship with ",https://outlook.office365.com/owa/?ItemID=AAMkAGY5Y2ZkY2U1LTZkMDAtNDdmMS1iN2YyLWRkYmRhYjljMGIyZQBGAAAAAAA1acH4l31PT5bYjWIdT7j8BwD0di2GbE5eQLmNvaC7hxKrAAAAAAEMAAD0di2GbE5eQLmNvaC7hxKrAALbsEWyAAA%3D&exvsurl=1&viewmodel=ReadMessageItem,rishabh.attri@bennett.edu.in,AAMkAGY5Y2ZkY2U1LTZkMDAtNDdmMS1iN2YyLWRkYmRhYjljMGIyZQBGAAAAAAA1acH4l31PT5bYjWIdT7j8BwD0di2GbE5eQLmNvaC7hxKrAAAAAAEMAAD0di2GbE5eQLmNvaC7hxKrAALbsEWyAAA=
Reminder about Project Showcase,"Dear Students, This is a gentle reminder about the upcomingВ Project Showcase, scheduled forВ 21st October 2024. This event provides an excellent opportunity for you to present your innovative projects to industry leaders and faculty members, with a chance to win exciting prizes.As a reminder,В project submissions are due by 10th October 2024. We encourage all interested students to approach the relevant Track Chair as soon as possible to discuss your project ideas. Each track has limited seats (maximum of 30), and spots are filling up quickly. Tracks will be closed once the seats are filled, even if that occurs before the official deadline, so donвҖҷt miss out on securing your spot!Below is the list of tracks, along with the corresponding Track Chair and contact details:оғ»оғ»TrackTrack ChairTrack Chair EmailTrack Chair Cabin NumberAI & Data ScienceDr. Umesh Guptaumesh.gupta@bennett.edu.inM-316, Third FloorDr. Aditya Bhardwajaditya.bhardwaj@bennett.edu.inM-302, Third FloorSoftware & AutomationDr. Deepika Pantoladeepika.pantola@bennett.edu.inM-34, First floorDr. Debjani Ghoshdebjani.ghosh@bennett.edu.inM-154, First FloorOpen InnovationDr. Anuj Kumar Bhartianuj.bharti@bennett.edu.inM-36, First FloorBlockchain & Cyber SecurityDr. Vimal Kumarvimal.kumar@bennett.edu.inM-12, First FloorEngineering & Applied ScienceDr. Abuzar Sayeedabuzar.sayeed@bennett.edu.inM-3, First FloorA separate track is reserved forВ SCSET Clubs & Chapters, and details will be conveyed to their respective leaders.Key Guidelines:Projects must be fully functional, innovative, and demonstrate originality.Team Size -В 2-6 Members.Limited seatsВ are available for each track, so students should visit the Track Chair's office as soon as possible.TheВ final deadline for project submissionsВ isВ 10th October 2024.Winners will be selected per track, and there will be two additional awards:Best All-Girl TeamSustainable Development Goal AwardWe look forward to seeing your creative projects come to life at the Project Showcase!Regards,Student Cabinet 2024-25School of CSETBennett UniversityВ Get Outlook for Android",https://outlook.office365.com/owa/?ItemID=AAMkAGY5Y2ZkY2U1LTZkMDAtNDdmMS1iN2YyLWRkYmRhYjljMGIyZQBGAAAAAAA1acH4l31PT5bYjWIdT7j8BwD0di2GbE5eQLmNvaC7hxKrAAAAAAEMAAD0di2GbE5eQLmNvaC7hxKrAALbsEWxAAA%3D&exvsurl=1&viewmodel=ReadMessageItem,dsa@bennett.edu.in,AAMkAGY5Y2ZkY2U1LTZkMDAtNDdmMS1iN2YyLWRkYmRhYjljMGIyZQBGAAAAAAA1acH4l31PT5bYjWIdT7j8BwD0di2GbE5eQLmNvaC7hxKrAAAAAAEMAAD0di2GbE5eQLmNvaC7hxKrAALbsEWxAAA=
Invitation to Attend Friendly Volleyball Match between Bennett University and Sharda University,"Dear Bennettians,В We are thrilled to extend a warm invitation to you to attend the friendly volleyball matches between Bennett University and Sharda University, scheduled to take place on October 05th, 2024.В Here are the details of the matches:Venue: Volleyball court , Bennett UniversityTime: 05:30 pm onwardsВ Your presence at the matches would not only add to the atmosphere of excitement but also serve as a source of encouragement for our talented athletes.В We look forward to seeing you at the matches and sharing the excitement of this sporting event.В Regards,Sports CommitteeGet Outlook for iOS",https://outlook.office365.com/owa/?ItemID=AAMkAGY5Y2ZkY2U1LTZkMDAtNDdmMS1iN2YyLWRkYmRhYjljMGIyZQBGAAAAAAA1acH4l31PT5bYjWIdT7j8BwD0di2GbE5eQLmNvaC7hxKrAAAAAAEMAAD0di2GbE5eQLmNvaC7hxKrAALbsEWwAAA%3D&exvsurl=1&viewmodel=ReadMessageItem,sportsdepartment@bennett.edu.in,AAMkAGY5Y2ZkY2U1LTZkMDAtNDdmMS1iN2YyLWRkYmRhYjljMGIyZQBGAAAAAAA1acH4l31PT5bYjWIdT7j8BwD0di2GbE5eQLmNvaC7hxKrAAAAAAEMAAD0di2GbE5eQLmNvaC7hxKrAALbsEWwAAA=
Re:  PLACEMENT OPPORTUNITY  || BRISTLE CONE || BTECH CSE 2025 BATCH. ,"Dear Students,Pre-Placement Talk is scheduled at Lecture Hall A-301(Opposite to Carrier Services Office 3rd Floor A Block) from 09:00am to 11:00 a.m.Please Note:Be in Formals & Carry Hard Copy of your Resumes. Please be on Time, 9:00amThis is the Simplest Drive where you just need to Justify your Resume & Projects.Your presence at the Pre-Placement session is mandatory, as it will equip you for the GD rounds and provide insights into ZopSmartвҖҷs culture and technical landscape. DonвҖҷt miss this crucial step in the process!Thanks & Regards,Naushad K H |В Regional Head Placement.Bennett University |The Times of India Group |В Plot No. 8-11, Techzone-II, Greater Noida.M: 9740616134В ,Web: www.bennett.edu.inFrom:В Naushad K H <Naushad.H@bennett.edu.in>Sent:В Friday, October 4, 2024 3:58 PMTo:В CSE 2021 <cse2021@bennett.edu.in>Cc:В Rakesh Singh <rakesh.singh@bennett.edu.in>; Neha Maheshwari <neha.maheshwari@bennett.edu.in>; Nitin Sood <Nitin.Sood@bennett.edu.in>; Mudit Sachdeva <mudit.sachdeva@bennett.edu.in>; Pallavi Mehta <Pallavi.Mehta@bennett.edu.in>; Ajith Abraham <Ajith.Abraham@bennett.edu.in>; Revati Jain <revati.jain@bennett.edu.in>; Senthil Kumar <senthil.kumar@bennett.edu.in>; Abhay Bansal <abhay.bansal@bennett.edu.in>; Arpit Bhardwaj <Arpit.Bhardwaj@bennett.edu.in>; Shuchi Rastogi <Shuchi.Rastogi@bennett.edu.in>; Pargat Singh <Pargat.Singh@bennett.edu.in>; Sandeep Singh <Sandeep.Singh@bennett.edu.in>; Pinki Dangwal <Pinki.Dangwal@bennett.edu.in>Subject:В Re: PLACEMENT OPPORTUNITY || BRISTLE CONE || BTECH CSE 2025 BATCH. В Dear Students,We are thrilled to announce that 73 students have been shortlisted for the interview rounds.В The interview is on campus. Kindly be present at 9 am sharp.В S.No.Roll NoName1E21CSEU0874SHIVAM2E21CSEU0452Nikita Bisht3E21CSEU0848Atishi Agrawal4E21CSEU0777Prakhar Ravindra Agrawal5E21CSEU0416Manya Sharma6E21CSEU0639Sumedha Sahni7E21CSEU0529RUCHIKA8E21CSEU0133Aditi Agarwal9E21CSEU0420mayankВ  rana Rana10E21CSEU0220ARYAN JAIN11E21CSEU0962VikeshВ  Laharpure12E21CSEU0003SEERSHIKA SRI NAGA MAMIDI13E21CSEU0432NALLAPATI BALA YASHASWINI14E21CSEU0964Aryan KiranВ  Jogdand15E21CSEU0013Pratham Ahuja16E21CSEU0459Om Sisodia17E21CSEU0465PARIGH GUPTA18E21CSEU0260Praveen Kumar Reddy Chevuri19E21CSEU0810Mahak Verma20E21CSEU0153ADITYA SINGHВ  RATHORE21E21CSEU0102Pulkit Mathur22E21CSEU0670Utkarsh Kumar23E21CSEU0045Arnav Talan24E21CSEU0202Anvita Sharma25E21CSEU0447Nayan Shandil26E21CSEU0947Manikanta Gangam27E21CSEU0865Abhinav Gautam28E21CSEU0581SHAURYA VARDHAN RATHORE29E21CSEU0221AryanВ  Jawla30E21CSEU0610Shubham Tripathi31E21CSEU0079Yash Choudhary32E21CSEU0762YASH Gupta33E21CSEU0379Krishan Kumar34E21CSEU0258Chetan Sharma35E21CSEU0817Dev Dua36E21CSEU0719Shrey Purohit37E21CSEU0526RIYA YADAV38E21CSEU0194Anshika Agarwal39E21CSEU0552Samrat Singh Bhandari40E21CSEU0517RICHA raperia41E21CSEU0795TARAN Goyal42E21CSEU0974Tarush Singh43E21CSEU0215Aryaman Saxena44E21CSEU0598SHREYA45E21CSEU0110Vanshaj Singhal46E21CSEU0164Akshat Jain47E21CSEU0898DHANANJAY48E21CSEU0377Khushi Tripathi49E21CSEU0922Devesh Ramawat50E21CSEU0141ADITYA PANDEY51E21CSEU0522RishiВ  Bahal52E21CSEU0005MEHUL PATHAK53E21CSEU0010PRAFFUL Agarwal54E21CSEU0254PILLA CHAITANYA55E21CSEU0975PRERITA SHARMA56E21CSEU0903RajatВ  Kumar57E21CSEU0892RichaВ  Lakshmi58E21CSEU0449Niharika Rana59E21CSEU0145Aditya Tyagi60E21CSEU0674VAIBHAV Sharma61E21CSEU0760Soumya Dubey62E21CSEU0877aashishВ  dhakad63E21CSEU0137Aditya Chaudhary64E21CSEU0578SHAURYA SAXENA65E21CSEU0135ADITYA VIKRAM SINGH66E21CSEU0408Mandeep Choudhary67E21CSEU0308Gaurav Kumar68E21CSEU0955PRIYANSHU SHARMA69E21CSEU0208Arnav Mittal70E21CSEU0926Vishal Baghel Baghel71E21CSEU0121AbhayВ  Kumar72E21CSEU0038AARUSH AGGARWAL73E21CSEU0087Avinash BurriThanks & Regards,Naushad K H |В Regional Head Placement.Bennett University |The Times of India Group |В Plot No. 8-11, Techzone-II, Greater Noida.M: 9740616134В ,Web: www.bennett.edu.inFrom:В Naushad K H <Naushad.H@bennett.edu.in>Sent:В Friday, October 4, 2024 2:45 PMTo:В CSE 2021 <cse2021@bennett.edu.in>Cc:В Rakesh Singh <rakesh.singh@bennett.edu.in>; Neha Maheshwari <neha.maheshwari@bennett.edu.in>; Nitin Sood <Nitin.Sood@bennett.edu.in>; Mudit Sachdeva <mudit.sachdeva@bennett.edu.in>; Pallavi Mehta <Pallavi.Mehta@bennett.edu.in>; Ajith Abraham <Ajith.Abraham@bennett.edu.in>; Revati Jain <revati.jain@bennett.edu.in>; Senthil Kumar <senthil.kumar@bennett.edu.in>; Abhay Bansal <abhay.bansal@bennett.edu.in>; Arpit Bhardwaj <Arpit.Bhardwaj@bennett.edu.in>; Shuchi Rastogi <Shuchi.Rastogi@bennett.edu.in>; Pargat Singh <Pargat.Singh@bennett.edu.in>; Sandeep Singh <Sandeep.Singh@bennett.edu.in>; Pinki Dangwal <Pinki.Dangwal@bennett.edu.in>Subject:В Re: PLACEMENT OPPORTUNITY || BRISTLE CONE || BTECH CSE 2025 BATCH. В Dear Students,Bristlecone will share the list of shortlisted candidates in one hour. Please adhere to the following guidelines:Prioritize Bristlecone:В Focus solely on Bristlecone and set aside any distractions regarding other marquee brands on October 7th. Lets be pragmatic in our approach.В Prepare for Resume-Based Questions:В All questions will stem from your resume, with particular emphasis on your projects, internships, and basic technical knowledge. Ensure clarity and precision in your resume to remove any ambiguity.Research Bristlecone:В Familiarize yourself with BristleconeвҖҷs website to understand its working culture and values.Best of luck!Thanks & Regards,Naushad K H |В Regional Head Placement.Bennett University |The Times of India Group |В Plot No. 8-11, Techzone-II, Greater Noida.M: 9740616134В ,Web: www.bennett.edu.inFrom:В Naushad K H <Naushad.H@bennett.edu.in>Sent:В Tuesday, October 1, 2024 5:35 PMTo:В CSE 2021 <cse2021@bennett.edu.in>Cc:В Rakesh Singh <rakesh.singh@bennett.edu.in>; Neha Maheshwari <neha.maheshwari@bennett.edu.in>; Nitin Sood <Nitin.Sood@bennett.edu.in>; Mudit Sachdeva <mudit.sachdeva@bennett.edu.in>; Pallavi Mehta <Pallavi.Mehta@bennett.edu.in>; Ajith Abraham <Ajith.Abraham@bennett.edu.in>; Revati Jain <revati.jain@bennett.edu.in>; Senthil Kumar <senthil.kumar@bennett.edu.in>; Abhay Bansal <abhay.bansal@bennett.edu.in>; Arpit Bhardwaj <Arpit.Bhardwaj@bennett.edu.in>; Shuchi Rastogi <Shuchi.Rastogi@bennett.edu.in>; Pargat Singh <Pargat.Singh@bennett.edu.in>; Sandeep Singh <Sandeep.Singh@bennett.edu.in>; Pinki Dangwal <Pinki.Dangwal@bennett.edu.in>Subject:В Re: PLACEMENT OPPORTUNITY || BRISTLE CONE || BTECH CSE 2025 BATCH. В Dear Students,Kindly attend the mandatory Bristlecone Online Aptitude Test.В  Make informed decisions about your future.В Test Details:Date: 3rd OctoberTime: 9 AM - 11 AM (sharp!) (online).We've convinced Bristlecone to go digital! Don't miss this opportunity.Interview Schedule:Date: 7th OctoberLocation: On-campus/In-personImportant:- All the registered students must participate.Bristlecone Process:Campus & DateDateTimeProcessВ Mode7-Oct-24Bennett University Plot No. 8-11, Techzone-II, Greater Noida.3-Oct9 to 11 AMAptitude TestLogical Reasoning TestOnline7-Oct9:30 AMPPT (Pre-Placement Talk)Co. overview and Job profile presentationIn PersonВ 10:30 AMGroup DiscussionStudents will be divided in groupsIn PersonВ Post GDPI InterviewsВ In PersonВ В Thanks & Regards,Naushad K H |В Regional Head Placement.Bennett University |The Times of India Group |В Plot No. 8-11, Techzone-II, Greater Noida.M: 9740616134В ,Web: www.bennett.edu.inFrom:В Naushad K H <Naushad.H@bennett.edu.in>Sent:В Tuesday, October 1, 2024 10:34 AMTo:В CSE 2021 <cse2021@bennett.edu.in>Cc:В Rakesh Singh <rakesh.singh@bennett.edu.in>; Neha Maheshwari <neha.maheshwari@bennett.edu.in>; Nitin Sood <Nitin.Sood@bennett.edu.in>; Mudit Sachdeva <mudit.sachdeva@bennett.edu.in>; Pallavi Mehta <Pallavi.Mehta@bennett.edu.in>; Ajith Abraham <Ajith.Abraham@bennett.edu.in>; Revati Jain <revati.jain@bennett.edu.in>; Senthil Kumar <senthil.kumar@bennett.edu.in>; Abhay Bansal <abhay.bansal@bennett.edu.in>; Arpit Bhardwaj <Arpit.Bhardwaj@bennett.edu.in>; Shuchi Rastogi <Shuchi.Rastogi@bennett.edu.in>; Pargat Singh <Pargat.Singh@bennett.edu.in>; Sandeep Singh <Sandeep.Singh@bennett.edu.in>; Pinki Dangwal <Pinki.Dangwal@bennett.edu.in>Subject:В Re: PLACEMENT OPPORTUNITY || BRISTLE CONE || BTECH CSE 2025 BATCH. В Dear Students,We are excited to announce that Bristlecone's recruitment process is underway!Important Dates:- Online Test: Scheduled soon (date TBA)- GD Round and Interviews: Planned for 7th October (awaiting final confirmation)Preparation:- Review relevant archives for Bristlecone to excel in the online test.В Benefits:- Placement opportunities for seeking students- Backup options for already placed students (joining not immediate)Stay tuned for updates!Thanks & Regards,Naushad K H |В Regional Head Placement.Bennett University |The Times of India Group |В Plot No. 8-11, Techzone-II, Greater Noida.M: 9740616134В ,Web: www.bennett.edu.inFrom:В Naushad K HSent:В Wednesday, September 11, 2024 10:04 AMTo:В CSE 2021 <cse2021@bennett.edu.in>Cc:В Rakesh Singh <rakesh.singh@bennett.edu.in>; Neha Maheshwari <neha.maheshwari@bennett.edu.in>; Nitin Sood <Nitin.Sood@bennett.edu.in>; Mudit Sachdeva <mudit.sachdeva@bennett.edu.in>; Pallavi Mehta <Pallavi.Mehta@bennett.edu.in>; Ajith Abraham <Ajith.Abraham@bennett.edu.in>; Revati Jain <revati.jain@bennett.edu.in>; Senthil Kumar <senthil.kumar@bennett.edu.in>; Abhay Bansal <abhay.bansal@bennett.edu.in>; Arpit Bhardwaj <Arpit.Bhardwaj@bennett.edu.in>; Shuchi Rastogi <Shuchi.Rastogi@bennett.edu.in>; Pargat Singh <Pargat.Singh@bennett.edu.in>Subject:В PLACEMENT OPPORTUNITY || BRISTLE CONE || BTECH CSE 2025 BATCH. В Dear Students,Seize the moment!We're excited to announce a placement opportunity with Bristlecone, a mass recruiter, for the 2025 batch. This is your chance to leverage the power of placement drives and kickstart your career!As we strive for excellence, we're committed to achieving good gender diversity. We believe that a diverse workforce is a key driver of innovation and success. This is a strong message from Bristle cone.В Entire process will be conducted offline. We are gearing up for a massive campus placement drive with Bristle Cone.В Here are the details:- Job Title: Associate - AI & Data Engineer- Location: Bristlecone Noida office- Work Mode: Offline- CTC: 4.75 LPA (fixed)Joining: Generally during the fag end of the course. (This is a great back up).В Registration will be opened on Superset.Thanks & Regards,Naushad K H |В Regional Head Placement.Bennett University |The Times of India Group |В Plot No. 8-11, Techzone-II, Greater Noida.M: 9740616134В ,Web: www.bennett.edu.in",https://outlook.office365.com/owa/?ItemID=AAMkAGY5Y2ZkY2U1LTZkMDAtNDdmMS1iN2YyLWRkYmRhYjljMGIyZQBGAAAAAAA1acH4l31PT5bYjWIdT7j8BwD0di2GbE5eQLmNvaC7hxKrAAAAAAEMAAD0di2GbE5eQLmNvaC7hxKrAALbsEWvAAA%3D&exvsurl=1&viewmodel=ReadMessageItem,Naushad.H@bennett.edu.in,AAMkAGY5Y2ZkY2U1LTZkMDAtNDdmMS1iN2YyLWRkYmRhYjljMGIyZQBGAAAAAAA1acH4l31PT5bYjWIdT7j8BwD0di2GbE5eQLmNvaC7hxKrAAAAAAEMAAD0di2GbE5eQLmNvaC7hxKrAALbsEWvAAA=
"Exciting new features: Custom Field permissions, reorder views and view groups, and more!","Check out this week's platform improvements. вҖҮвҖҮп»ҝНҸ вҖҮп»ҝНҸ вҖҮп»ҝНҸ вҖҮп»ҝНҸ вҖҮп»ҝНҸ вҖҮп»ҝНҸ вҖҮп»ҝНҸ вҖҮп»ҝНҸ вҖҮп»ҝНҸ вҖҮп»ҝНҸ вҖҮп»ҝНҸ вҖҮп»ҝНҸ вҖҮп»ҝНҸ вҖҮп»ҝНҸ вҖҮп»ҝНҸ вҖҮп»ҝНҸ вҖҮп»ҝНҸ вҖҮп»ҝНҸ вҖҮп»ҝНҸ вҖҮп»ҝНҸ вҖҮп»ҝНҸ вҖҮп»ҝНҸ вҖҮп»ҝНҸ вҖҮп»ҝНҸ вҖҮп»ҝНҸ вҖҮп»ҝНҸ вҖҮп»ҝНҸ вҖҮп»ҝНҸ вҖҮп»ҝНҸ вҖҮп»ҝНҸ вҖҮп»ҝНҸ вҖҮп»ҝНҸ вҖҮп»ҝНҸ вҖҮп»ҝНҸ вҖҮп»ҝНҸ вҖҮп»ҝНҸ вҖҮп»ҝНҸ вҖҮп»ҝНҸ вҖҮп»ҝНҸ вҖҮп»ҝНҸ вҖҮп»ҝНҸ вҖҮп»ҝНҸ вҖҮп»ҝНҸ вҖҮп»ҝНҸ вҖҮп»ҝНҸ вҖҮп»ҝНҸ вҖҮп»ҝНҸ вҖҮп»ҝНҸ вҖҮп»ҝНҸ вҖҮп»ҝНҸ вҖҮп»ҝНҸ вҖҮп»ҝНҸ вҖҮп»ҝНҸ вҖҮп»ҝНҸ вҖҮп»ҝНҸ вҖҮп»ҝНҸ вҖҮп»ҝНҸ вҖҮп»ҝНҸ вҖҮп»ҝНҸ вҖҮп»ҝНҸ вҖҮп»ҝНҸ вҖҮп»ҝНҸ вҖҮп»ҝНҸ вҖҮп»ҝНҸ вҖҮп»ҝНҸ вҖҮп»ҝНҸ вҖҮп»ҝНҸ вҖҮп»ҝНҸ вҖҮп»ҝНҸ вҖҮп»ҝНҸ вҖҮп»ҝНҸ вҖҮп»ҝНҸ вҖҮп»ҝНҸ вҖҮп»ҝНҸ вҖҮп»ҝНҸ вҖҮп»ҝНҸ вҖҮп»ҝНҸ вҖҮп»ҝНҸ вҖҮп»ҝНҸ вҖҮп»ҝНҸ вҖҮп»ҝНҸ вҖҮп»ҝНҸ вҖҮп»ҝНҸ вҖҮп»ҝНҸ вҖҮп»ҝНҸ вҖҮп»ҝНҸ вҖҮп»ҝНҸ вҖҮп»ҝНҸ вҖҮп»ҝНҸ вҖҮп»ҝНҸMaking the world more productive, together.вҖҠClickUpdates 3.34New features and improvementsThis week's ClickUpdates brings you Custom Field permissions, the ability to reorder all views and view groups, and more!вҖҠвҖҠView release notesвҖҠвҖҠPrivate Custom Fields and permissionsExperience powerful customization and take control of your Custom Fields with field-specific permissions. Use Custom Field permissions to control who can view, edit, or set values for each field, or keep fields private if needed.В вҖҠReorder views and view groupsYou can now reorder all your views and view groups without pinning them, allowing you to quickly rearrange your views for easy access.вҖҠGroup by task type in Dashboard cardsNow, you can group by task type in line, bar, pie, and battery charts to help you understand the type of work being done.вҖҠвҖҠUpdate: In accordance with GDPR, we are required to notify you that we added a new subprocessor, Anthropic.вҖҠView release notesвҖҠвҖҠHelp us build ClickUpвҖҠвҡЎDynamic dates for Automations: Use dynamic dates in Automations.рҹ“Ҡ Automated Dashboard reporting: Schedule your Dashboard exports.вһ— Use any field in a Formula (planned): Use any standard field or Custom Field in a Formula.вҖҠSuggest and vote on featuresвҖҠвҖҠTake ClickUp on the goвҖҠВ© 2024 ClickUp | 350 Tenth Ave. Suite 500, San Diego, CA 92101 | Privacy Policy Unsubscribe ",https://outlook.office365.com/owa/?ItemID=AAMkAGY5Y2ZkY2U1LTZkMDAtNDdmMS1iN2YyLWRkYmRhYjljMGIyZQBGAAAAAAA1acH4l31PT5bYjWIdT7j8BwD0di2GbE5eQLmNvaC7hxKrAAAAAAEMAAD0di2GbE5eQLmNvaC7hxKrAALbsEWuAAA%3D&exvsurl=1&viewmodel=ReadMessageItem,clickupdates@mail.clickup.com,AAMkAGY5Y2ZkY2U1LTZkMDAtNDdmMS1iN2YyLWRkYmRhYjljMGIyZQBGAAAAAAA1acH4l31PT5bYjWIdT7j8BwD0di2GbE5eQLmNvaC7hxKrAAAAAAEMAAD0di2GbE5eQLmNvaC7hxKrAALbsEWuAAA=
