Subject,Body,Link,Sender,ID
Re:  PLACEMENT OPPORTUNITY  || BRISTLE CONE || BTECH CSE 2025 BATCH. ,"Dear Students,We are thrilled to announce that 73 students have been shortlisted for the interview rounds.В The interview is on campus. Kindly be present at 9 am sharp.В S.No.Roll NoName1E21CSEU0874SHIVAM2E21CSEU0452Nikita Bisht3E21CSEU0848Atishi Agrawal4E21CSEU0777Prakhar Ravindra Agrawal5E21CSEU0416Manya Sharma6E21CSEU0639Sumedha Sahni7E21CSEU0529RUCHIKA8E21CSEU0133Aditi Agarwal9E21CSEU0420mayankВ  rana Rana10E21CSEU0220ARYAN JAIN11E21CSEU0962VikeshВ  Laharpure12E21CSEU0003SEERSHIKA SRI NAGA MAMIDI13E21CSEU0432NALLAPATI BALA YASHASWINI14E21CSEU0964Aryan KiranВ  Jogdand15E21CSEU0013Pratham Ahuja16E21CSEU0459Om Sisodia17E21CSEU0465PARIGH GUPTA18E21CSEU0260Praveen Kumar Reddy Chevuri19E21CSEU0810Mahak Verma20E21CSEU0153ADITYA SINGHВ  RATHORE21E21CSEU0102Pulkit Mathur22E21CSEU0670Utkarsh Kumar23E21CSEU0045Arnav Talan24E21CSEU0202Anvita Sharma25E21CSEU0447Nayan Shandil26E21CSEU0947Manikanta Gangam27E21CSEU0865Abhinav Gautam28E21CSEU0581SHAURYA VARDHAN RATHORE29E21CSEU0221AryanВ  Jawla30E21CSEU0610Shubham Tripathi31E21CSEU0079Yash Choudhary32E21CSEU0762YASH Gupta33E21CSEU0379Krishan Kumar34E21CSEU0258Chetan Sharma35E21CSEU0817Dev Dua36E21CSEU0719Shrey Purohit37E21CSEU0526RIYA YADAV38E21CSEU0194Anshika Agarwal39E21CSEU0552Samrat Singh Bhandari40E21CSEU0517RICHA raperia41E21CSEU0795TARAN Goyal42E21CSEU0974Tarush Singh43E21CSEU0215Aryaman Saxena44E21CSEU0598SHREYA45E21CSEU0110Vanshaj Singhal46E21CSEU0164Akshat Jain47E21CSEU0898DHANANJAY48E21CSEU0377Khushi Tripathi49E21CSEU0922Devesh Ramawat50E21CSEU0141ADITYA PANDEY51E21CSEU0522RishiВ  Bahal52E21CSEU0005MEHUL PATHAK53E21CSEU0010PRAFFUL Agarwal54E21CSEU0254PILLA CHAITANYA55E21CSEU0975PRERITA SHARMA56E21CSEU0903RajatВ  Kumar57E21CSEU0892RichaВ  Lakshmi58E21CSEU0449Niharika Rana59E21CSEU0145Aditya Tyagi60E21CSEU0674VAIBHAV Sharma61E21CSEU0760Soumya Dubey62E21CSEU0877aashishВ  dhakad63E21CSEU0137Aditya Chaudhary64E21CSEU0578SHAURYA SAXENA65E21CSEU0135ADITYA VIKRAM SINGH66E21CSEU0408Mandeep Choudhary67E21CSEU0308Gaurav Kumar68E21CSEU0955PRIYANSHU SHARMA69E21CSEU0208Arnav Mittal70E21CSEU0926Vishal Baghel Baghel71E21CSEU0121AbhayВ  Kumar72E21CSEU0038AARUSH AGGARWAL73E21CSEU0087Avinash BurriThanks & Regards,Naushad K H |В Regional Head Placement.Bennett University |The Times of India Group |В Plot No. 8-11, Techzone-II, Greater Noida.M: 9740616134В ,Web: www.bennett.edu.inFrom: Naushad K H <Naushad.H@bennett.edu.in>Sent: Friday, October 4, 2024 2:45 PMTo: CSE 2021 <cse2021@bennett.edu.in>Cc: Rakesh Singh <rakesh.singh@bennett.edu.in>; Neha Maheshwari <neha.maheshwari@bennett.edu.in>; Nitin Sood <Nitin.Sood@bennett.edu.in>; Mudit Sachdeva <mudit.sachdeva@bennett.edu.in>; Pallavi Mehta <Pallavi.Mehta@bennett.edu.in>; Ajith Abraham <Ajith.Abraham@bennett.edu.in>; Revati Jain <revati.jain@bennett.edu.in>; Senthil Kumar <senthil.kumar@bennett.edu.in>; Abhay Bansal <abhay.bansal@bennett.edu.in>; Arpit Bhardwaj <Arpit.Bhardwaj@bennett.edu.in>; Shuchi Rastogi <Shuchi.Rastogi@bennett.edu.in>; Pargat Singh <Pargat.Singh@bennett.edu.in>; Sandeep Singh <Sandeep.Singh@bennett.edu.in>; Pinki Dangwal <Pinki.Dangwal@bennett.edu.in>Subject: Re: PLACEMENT OPPORTUNITY || BRISTLE CONE || BTECH CSE 2025 BATCH. В Dear Students,Bristlecone will share the list of shortlisted candidates in one hour. Please adhere to the following guidelines:Prioritize Bristlecone:В Focus solely on Bristlecone and set aside any distractions regarding other marquee brands on October 7th. Lets be pragmatic in our approach.В Prepare for Resume-Based Questions:В All questions will stem from your resume, with particular emphasis on your projects, internships, and basic technical knowledge. Ensure clarity and precision in your resume to remove any ambiguity.Research Bristlecone:В Familiarize yourself with BristleconeвҖҷs website to understand its working culture and values.Best of luck!Thanks & Regards,Naushad K H |В Regional Head Placement.Bennett University |The Times of India Group |В Plot No. 8-11, Techzone-II, Greater Noida.M: 9740616134В ,Web: www.bennett.edu.inFrom: Naushad K H <Naushad.H@bennett.edu.in>Sent: Tuesday, October 1, 2024 5:35 PMTo: CSE 2021 <cse2021@bennett.edu.in>Cc: Rakesh Singh <rakesh.singh@bennett.edu.in>; Neha Maheshwari <neha.maheshwari@bennett.edu.in>; Nitin Sood <Nitin.Sood@bennett.edu.in>; Mudit Sachdeva <mudit.sachdeva@bennett.edu.in>; Pallavi Mehta <Pallavi.Mehta@bennett.edu.in>; Ajith Abraham <Ajith.Abraham@bennett.edu.in>; Revati Jain <revati.jain@bennett.edu.in>; Senthil Kumar <senthil.kumar@bennett.edu.in>; Abhay Bansal <abhay.bansal@bennett.edu.in>; Arpit Bhardwaj <Arpit.Bhardwaj@bennett.edu.in>; Shuchi Rastogi <Shuchi.Rastogi@bennett.edu.in>; Pargat Singh <Pargat.Singh@bennett.edu.in>; Sandeep Singh <Sandeep.Singh@bennett.edu.in>; Pinki Dangwal <Pinki.Dangwal@bennett.edu.in>Subject: Re: PLACEMENT OPPORTUNITY || BRISTLE CONE || BTECH CSE 2025 BATCH. В Dear Students,Kindly attend the mandatory Bristlecone Online Aptitude Test.В  Make informed decisions about your future.В Test Details:Date: 3rd OctoberTime: 9 AM - 11 AM (sharp!) (online).We've convinced Bristlecone to go digital! Don't miss this opportunity.Interview Schedule:Date: 7th OctoberLocation: On-campus/In-personImportant:- All the registered students must participate.Bristlecone Process:Campus & DateDateTimeProcessВ Mode7-Oct-24Bennett University Plot No. 8-11, Techzone-II, Greater Noida.3-Oct9 to 11 AMAptitude TestLogical Reasoning TestOnline7-Oct9:30 AMPPT (Pre-Placement Talk)Co. overview and Job profile presentationIn PersonВ 10:30 AMGroup DiscussionStudents will be divided in groupsIn PersonВ Post GDPI InterviewsВ In PersonВ В Thanks & Regards,Naushad K H |В Regional Head Placement.Bennett University |The Times of India Group |В Plot No. 8-11, Techzone-II, Greater Noida.M: 9740616134В ,Web: www.bennett.edu.inFrom: Naushad K H <Naushad.H@bennett.edu.in>Sent: Tuesday, October 1, 2024 10:34 AMTo: CSE 2021 <cse2021@bennett.edu.in>Cc: Rakesh Singh <rakesh.singh@bennett.edu.in>; Neha Maheshwari <neha.maheshwari@bennett.edu.in>; Nitin Sood <Nitin.Sood@bennett.edu.in>; Mudit Sachdeva <mudit.sachdeva@bennett.edu.in>; Pallavi Mehta <Pallavi.Mehta@bennett.edu.in>; Ajith Abraham <Ajith.Abraham@bennett.edu.in>; Revati Jain <revati.jain@bennett.edu.in>; Senthil Kumar <senthil.kumar@bennett.edu.in>; Abhay Bansal <abhay.bansal@bennett.edu.in>; Arpit Bhardwaj <Arpit.Bhardwaj@bennett.edu.in>; Shuchi Rastogi <Shuchi.Rastogi@bennett.edu.in>; Pargat Singh <Pargat.Singh@bennett.edu.in>; Sandeep Singh <Sandeep.Singh@bennett.edu.in>; Pinki Dangwal <Pinki.Dangwal@bennett.edu.in>Subject: Re: PLACEMENT OPPORTUNITY || BRISTLE CONE || BTECH CSE 2025 BATCH. В Dear Students,We are excited to announce that Bristlecone's recruitment process is underway!Important Dates:- Online Test: Scheduled soon (date TBA)- GD Round and Interviews: Planned for 7th October (awaiting final confirmation)Preparation:- Review relevant archives for Bristlecone to excel in the online test.В Benefits:- Placement opportunities for seeking students- Backup options for already placed students (joining not immediate)Stay tuned for updates!Thanks & Regards,Naushad K H |В Regional Head Placement.Bennett University |The Times of India Group |В Plot No. 8-11, Techzone-II, Greater Noida.M: 9740616134В ,Web: www.bennett.edu.inFrom: Naushad K HSent: Wednesday, September 11, 2024 10:04 AMTo: CSE 2021 <cse2021@bennett.edu.in>Cc: Rakesh Singh <rakesh.singh@bennett.edu.in>; Neha Maheshwari <neha.maheshwari@bennett.edu.in>; Nitin Sood <Nitin.Sood@bennett.edu.in>; Mudit Sachdeva <mudit.sachdeva@bennett.edu.in>; Pallavi Mehta <Pallavi.Mehta@bennett.edu.in>; Ajith Abraham <Ajith.Abraham@bennett.edu.in>; Revati Jain <revati.jain@bennett.edu.in>; Senthil Kumar <senthil.kumar@bennett.edu.in>; Abhay Bansal <abhay.bansal@bennett.edu.in>; Arpit Bhardwaj <Arpit.Bhardwaj@bennett.edu.in>; Shuchi Rastogi <Shuchi.Rastogi@bennett.edu.in>; Pargat Singh <Pargat.Singh@bennett.edu.in>Subject: PLACEMENT OPPORTUNITY || BRISTLE CONE || BTECH CSE 2025 BATCH. В Dear Students,Seize the moment!We're excited to announce a placement opportunity with Bristlecone, a mass recruiter, for the 2025 batch. This is your chance to leverage the power of placement drives and kickstart your career!As we strive for excellence, we're committed to achieving good gender diversity. We believe that a diverse workforce is a key driver of innovation and success. This is a strong message from Bristle cone.В Entire process will be conducted offline. We are gearing up for a massive campus placement drive with Bristle Cone.В Here are the details:- Job Title: Associate - AI & Data Engineer- Location: Bristlecone Noida office- Work Mode: Offline- CTC: 4.75 LPA (fixed)Joining: Generally during the fag end of the course. (This is a great back up).В Registration will be opened on Superset.Thanks & Regards,Naushad K H |В Regional Head Placement.Bennett University |The Times of India Group |В Plot No. 8-11, Techzone-II, Greater Noida.M: 9740616134В ,Web: www.bennett.edu.in",https://outlook.office365.com/owa/?ItemID=AAMkAGY5Y2ZkY2U1LTZkMDAtNDdmMS1iN2YyLWRkYmRhYjljMGIyZQBGAAAAAAA1acH4l31PT5bYjWIdT7j8BwD0di2GbE5eQLmNvaC7hxKrAAAAAAEMAAD0di2GbE5eQLmNvaC7hxKrAALbsEWnAAA%3D&exvsurl=1&viewmodel=ReadMessageItem,Naushad.H@bennett.edu.in,AAMkAGY5Y2ZkY2U1LTZkMDAtNDdmMS1iN2YyLWRkYmRhYjljMGIyZQBGAAAAAAA1acH4l31PT5bYjWIdT7j8BwD0di2GbE5eQLmNvaC7hxKrAAAAAAEMAAD0di2GbE5eQLmNvaC7hxKrAALbsEWnAAA=
Captains & Vice Captains Reveal 2024-25.,"Dear all,Congratulations! We are thrilled to extend our heartfelt felicitation to the newly appointed Captains and Vice-Captains for being anointed as the light bearers of Sports Committee for the upcoming term of 2024-25.В We believe that your selection as leaders in the realm of sports is a testament to your outstanding abilities and thereforeВ we are rest assured that each and every one of you with your grit, conviction, and unparalleled devotion will rise up to our expectations and continue the golden legacy of the Sports Committee forward.В We wish you good luck for your future endeavours.В В ",https://outlook.office365.com/owa/?ItemID=AAMkAGY5Y2ZkY2U1LTZkMDAtNDdmMS1iN2YyLWRkYmRhYjljMGIyZQBGAAAAAAA1acH4l31PT5bYjWIdT7j8BwD0di2GbE5eQLmNvaC7hxKrAAAAAAEMAAD0di2GbE5eQLmNvaC7hxKrAALbsEWlAAA%3D&exvsurl=1&viewmodel=ReadMessageItem,sportsdepartment@bennett.edu.in,AAMkAGY5Y2ZkY2U1LTZkMDAtNDdmMS1iN2YyLWRkYmRhYjljMGIyZQBGAAAAAAA1acH4l31PT5bYjWIdT7j8BwD0di2GbE5eQLmNvaC7hxKrAAAAAAEMAAD0di2GbE5eQLmNvaC7hxKrAALbsEWlAAA=
Update:   Internship + PPO opportunity || Jungleworks || Btech Batch 2025 || 6 LPA,"Dear Students,В A total of 57 students have been shortlisted for the technical round of interviews. The first 28 students will have their interviews scheduled on Monday at 3:30 PM. The remaining students, from 29 to 57, will have their interviews on Tuesday, also at 3:30 PM. You will receive the invite from the company very soon.В В S.No.NameRoll No1NALLAPATI BALA YASHASWINIE21CSEU04322SEERSHIKA SRI NAGA MAMIDIE21CSEU00033Abhay NagarE21CSEU00594Tanya JainE21CSEU06585Daksh VasudevE21CSEU02676KUMAR ANMOLE21CSEU03857DHANANJAYE21CSEU08988Jahnvi sahniE21CSEU00689Pankaj singh SinghE21CSEU089910Shrey PurohitE21CSEU071911Pratham AhujaE21CSEU001312BIPLABA KUMAR SAMALE21CSEU078313Praveen Kumar Reddy ChevuriE21CSEU026014NISHTHA GARGE21CSEU045315Yatharth AgarwalE21CSEU071116Khushi GargE21CSEU007017MEHUL PATHAKE21CSEU000518RISHIKA SONKERE21CSEU002019Shaurya ThakurE21CSEU058020Ria PahujaniE21CSEU051621Vanshaj SinghalE21CSEU011022Gaurav KumarE21CSEU030823Akshat AgarwalE21CSEU080624Preetika PargaiE21CSEU002925Nidhi JainE21CSEU044826KATAKAM GOKUL ANJANEYULUE21CSEU036927Nayan ShandilE21CSEU044728Manoranjan KumarE21CSEU041229HARSHVARDHAN SINGHE21CSEU033530Ankit Kumar SinghE21CSEU018731Manikanta GangamE21CSEU094732Rakshit HarshE21CSEU051033Aryan GuptaE21CSEU021934SIDHARTH LOHCHABE21CSEU061935Aryaman SaxenaE21CSEU021536SPARSH ARYANE21CSEU063037SAKSHAM JINDALE21CSEU054038PARIGH GUPTAE21CSEU046539Deepanshu JainE21CSEU027340Nikhar AroraE21CSEU045041Arnav MittalE21CSEU020842Vani TripathiE21CSEU068043Girendra SinsinwarE21CSEU077244Syed Mohammed ShahidE21CSEU094945Om ChoudharyE21CSEU093346RITIK KHULBEE21CSEU052347Shreejeet PurwarE21CSEU059648Tejas MadhukarE21CSEU066149RUCHIKAE21CSEU052950Vishal Baghel BaghelE21CSEU092651Vishakh NeelakantanE21CSEU003552Ibrahim KhanE21CSEU033953Smriti AgarwalE21CSEU090154ATUL RAIE21CSEU023455Rishi BahalE21CSEU052256Ayushman ChaturvediE21CSEU077357Shreyash KumarE21CSEU0604В В Regards,Mudit SachdevaВ |В Industry RelationsBennett UniversityGreater Noida 201310, Uttar Pradesh, Indiahttps://www.bennett.edu.in/Email:В mudit.sachdeva@bennett.edu.inTel: В  +91-8839441583В В В В В В В В В В В В From: Mudit Sachdeva Sent: 20 September 2024 14:45To: CSE 2021 <cse2021@bennett.edu.in>Cc: Rakesh Singh <rakesh.singh@bennett.edu.in>; Neha Maheshwari <neha.maheshwari@bennett.edu.in>; Nitin Sood <Nitin.Sood@bennett.edu.in>; Naushad K H <Naushad.H@bennett.edu.in>; Varun sharma <varun.sharma@bennett.edu.in>; Pargat Singh <Pargat.Singh@bennett.edu.in>; Pallavi Mehta <Pallavi.Mehta@bennett.edu.in>; Abhay Bansal <abhay.bansal@bennett.edu.in>; Tapas Badal <tapas.badal@bennett.edu.in>; Bharat Gupta <bharat.gupta@bennett.edu.in>; Deepak Rai <deepak.rai@bennett.edu.in>; Sumit Badotra <Sumit.Badotra@bennett.edu.in>; Revati Jain <revati.jain@bennett.edu.in>; Ajith Abraham <Ajith.Abraham@bennett.edu.in>; Senthil Kumar <senthil.kumar@bennett.edu.in>; Rishabh Attri <rishabh.attri@bennett.edu.in>Subject: Internship + PPO opportunity || Jungleworks || Btech Batch 2025 || 6 LPAВ В Dear Students,В Internship + PPO opportunity at Jungleworks, students are required to go through details below and register on Superset latest by, 22nd September, 2024 before 5:00 PM. В Website: https://jungleworks.com/В About the company:We started as Click Labs in 2011 with a thought of nurturing innovative business ideas and now we at Jungleworks are market leaders in delivering state of the art tech solutions for enterprises to provide an omnichannel presence. We believe in giving life to the dream business projects and providing a hassle free experience. We've been successful in offering an extensive online platform for any business genre from starting to running and to reaching new growth parameters.CTC : 6 LPADesignation : Associate Software EngineerВ В В В В В В В  Stipend : 15k Per MonthWork from OfficeВ Regards,Mudit SachdevaВ |В Industry RelationsBennett UniversityGreater Noida 201310, Uttar Pradesh, Indiahttps://www.bennett.edu.in/Email:В mudit.sachdeva@bennett.edu.inTel: В  +91-8839441583В В В В В В В В В В В ",https://outlook.office365.com/owa/?ItemID=AAMkAGY5Y2ZkY2U1LTZkMDAtNDdmMS1iN2YyLWRkYmRhYjljMGIyZQBGAAAAAAA1acH4l31PT5bYjWIdT7j8BwD0di2GbE5eQLmNvaC7hxKrAAAAAAEMAAD0di2GbE5eQLmNvaC7hxKrAALbsEWkAAA%3D&exvsurl=1&viewmodel=ReadMessageItem,mudit.sachdeva@bennett.edu.in,AAMkAGY5Y2ZkY2U1LTZkMDAtNDdmMS1iN2YyLWRkYmRhYjljMGIyZQBGAAAAAAA1acH4l31PT5bYjWIdT7j8BwD0di2GbE5eQLmNvaC7hxKrAAAAAAEMAAD0di2GbE5eQLmNvaC7hxKrAALbsEWkAAA=
[REMINDER] Open for application - Growth Jockey Private Limited's Job Profile : 1. Frontend Developer 2. Backend Developer,"   New Job Opening from Growth Jockey Private Limited! Dear Student,  Growth Jockey Private Limited's Job Profile - 1. Frontend Developer 2. Backend Developer in Category 1 category is accepting applications from candidates and the deadline is approaching. Interested candidates are requested to apply immediately. Deadline : Oct 04, 04:00 PM Additional Details : Job Profile Category :Category 1Click to Apply Thanks, Team Superset   This is a system generated email. Please do not reply to this. You are receiving this email because you have subscribed to our list. To Unsubscribe or to change email preference please visit your profile. Copyright 2022-23     ",https://outlook.office365.com/owa/?ItemID=AAMkAGY5Y2ZkY2U1LTZkMDAtNDdmMS1iN2YyLWRkYmRhYjljMGIyZQBGAAAAAAA1acH4l31PT5bYjWIdT7j8BwD0di2GbE5eQLmNvaC7hxKrAAAAAAEMAAD0di2GbE5eQLmNvaC7hxKrAALbsEWjAAA%3D&exvsurl=1&viewmodel=ReadMessageItem,notifications@email.joinsuperset.com,AAMkAGY5Y2ZkY2U1LTZkMDAtNDdmMS1iN2YyLWRkYmRhYjljMGIyZQBGAAAAAAA1acH4l31PT5bYjWIdT7j8BwD0di2GbE5eQLmNvaC7hxKrAAAAAAEMAAD0di2GbE5eQLmNvaC7hxKrAALbsEWjAAA=
Re:  PLACEMENT OPPORTUNITY  || BRISTLE CONE || BTECH CSE 2025 BATCH. ,"Dear Students,Bristlecone will share the list of shortlisted candidates in one hour. Please adhere to the following guidelines:Prioritize Bristlecone:В Focus solely on Bristlecone and set aside any distractions regarding other marquee brands on October 7th. Lets be pragmatic in our approach.В Prepare for Resume-Based Questions:В All questions will stem from your resume, with particular emphasis on your projects, internships, and basic technical knowledge. Ensure clarity and precision in your resume to remove any ambiguity.Research Bristlecone:В Familiarize yourself with BristleconeвҖҷs website to understand its working culture and values.Best of luck!Thanks & Regards,Naushad K H |В Regional Head Placement.Bennett University |The Times of India Group |В Plot No. 8-11, Techzone-II, Greater Noida.M: 9740616134В ,Web: www.bennett.edu.inFrom: Naushad K H <Naushad.H@bennett.edu.in>Sent: Tuesday, October 1, 2024 5:35 PMTo: CSE 2021 <cse2021@bennett.edu.in>Cc: Rakesh Singh <rakesh.singh@bennett.edu.in>; Neha Maheshwari <neha.maheshwari@bennett.edu.in>; Nitin Sood <Nitin.Sood@bennett.edu.in>; Mudit Sachdeva <mudit.sachdeva@bennett.edu.in>; Pallavi Mehta <Pallavi.Mehta@bennett.edu.in>; Ajith Abraham <Ajith.Abraham@bennett.edu.in>; Revati Jain <revati.jain@bennett.edu.in>; Senthil Kumar <senthil.kumar@bennett.edu.in>; Abhay Bansal <abhay.bansal@bennett.edu.in>; Arpit Bhardwaj <Arpit.Bhardwaj@bennett.edu.in>; Shuchi Rastogi <Shuchi.Rastogi@bennett.edu.in>; Pargat Singh <Pargat.Singh@bennett.edu.in>; Sandeep Singh <Sandeep.Singh@bennett.edu.in>; Pinki Dangwal <Pinki.Dangwal@bennett.edu.in>Subject: Re: PLACEMENT OPPORTUNITY || BRISTLE CONE || BTECH CSE 2025 BATCH. В Dear Students,Kindly attend the mandatory Bristlecone Online Aptitude Test.В  Make informed decisions about your future.В Test Details:Date: 3rd OctoberTime: 9 AM - 11 AM (sharp!) (online).We've convinced Bristlecone to go digital! Don't miss this opportunity.Interview Schedule:Date: 7th OctoberLocation: On-campus/In-personImportant:- All the registered students must participate.Bristlecone Process:Campus & DateDateTimeProcessВ Mode7-Oct-24Bennett University Plot No. 8-11, Techzone-II, Greater Noida.3-Oct9 to 11 AMAptitude TestLogical Reasoning TestOnline7-Oct9:30 AMPPT (Pre-Placement Talk)Co. overview and Job profile presentationIn PersonВ 10:30 AMGroup DiscussionStudents will be divided in groupsIn PersonВ Post GDPI InterviewsВ In PersonВ В Thanks & Regards,Naushad K H |В Regional Head Placement.Bennett University |The Times of India Group |В Plot No. 8-11, Techzone-II, Greater Noida.M: 9740616134В ,Web: www.bennett.edu.inFrom: Naushad K H <Naushad.H@bennett.edu.in>Sent: Tuesday, October 1, 2024 10:34 AMTo: CSE 2021 <cse2021@bennett.edu.in>Cc: Rakesh Singh <rakesh.singh@bennett.edu.in>; Neha Maheshwari <neha.maheshwari@bennett.edu.in>; Nitin Sood <Nitin.Sood@bennett.edu.in>; Mudit Sachdeva <mudit.sachdeva@bennett.edu.in>; Pallavi Mehta <Pallavi.Mehta@bennett.edu.in>; Ajith Abraham <Ajith.Abraham@bennett.edu.in>; Revati Jain <revati.jain@bennett.edu.in>; Senthil Kumar <senthil.kumar@bennett.edu.in>; Abhay Bansal <abhay.bansal@bennett.edu.in>; Arpit Bhardwaj <Arpit.Bhardwaj@bennett.edu.in>; Shuchi Rastogi <Shuchi.Rastogi@bennett.edu.in>; Pargat Singh <Pargat.Singh@bennett.edu.in>; Sandeep Singh <Sandeep.Singh@bennett.edu.in>; Pinki Dangwal <Pinki.Dangwal@bennett.edu.in>Subject: Re: PLACEMENT OPPORTUNITY || BRISTLE CONE || BTECH CSE 2025 BATCH. В Dear Students,We are excited to announce that Bristlecone's recruitment process is underway!Important Dates:- Online Test: Scheduled soon (date TBA)- GD Round and Interviews: Planned for 7th October (awaiting final confirmation)Preparation:- Review relevant archives for Bristlecone to excel in the online test.В Benefits:- Placement opportunities for seeking students- Backup options for already placed students (joining not immediate)Stay tuned for updates!Thanks & Regards,Naushad K H |В Regional Head Placement.Bennett University |The Times of India Group |В Plot No. 8-11, Techzone-II, Greater Noida.M: 9740616134В ,Web: www.bennett.edu.inFrom: Naushad K HSent: Wednesday, September 11, 2024 10:04 AMTo: CSE 2021 <cse2021@bennett.edu.in>Cc: Rakesh Singh <rakesh.singh@bennett.edu.in>; Neha Maheshwari <neha.maheshwari@bennett.edu.in>; Nitin Sood <Nitin.Sood@bennett.edu.in>; Mudit Sachdeva <mudit.sachdeva@bennett.edu.in>; Pallavi Mehta <Pallavi.Mehta@bennett.edu.in>; Ajith Abraham <Ajith.Abraham@bennett.edu.in>; Revati Jain <revati.jain@bennett.edu.in>; Senthil Kumar <senthil.kumar@bennett.edu.in>; Abhay Bansal <abhay.bansal@bennett.edu.in>; Arpit Bhardwaj <Arpit.Bhardwaj@bennett.edu.in>; Shuchi Rastogi <Shuchi.Rastogi@bennett.edu.in>; Pargat Singh <Pargat.Singh@bennett.edu.in>Subject: PLACEMENT OPPORTUNITY || BRISTLE CONE || BTECH CSE 2025 BATCH. В Dear Students,Seize the moment!We're excited to announce a placement opportunity with Bristlecone, a mass recruiter, for the 2025 batch. This is your chance to leverage the power of placement drives and kickstart your career!As we strive for excellence, we're committed to achieving good gender diversity. We believe that a diverse workforce is a key driver of innovation and success. This is a strong message from Bristle cone.В Entire process will be conducted offline. We are gearing up for a massive campus placement drive with Bristle Cone.В Here are the details:- Job Title: Associate - AI & Data Engineer- Location: Bristlecone Noida office- Work Mode: Offline- CTC: 4.75 LPA (fixed)Joining: Generally during the fag end of the course. (This is a great back up).В Registration will be opened on Superset.Thanks & Regards,Naushad K H |В Regional Head Placement.Bennett University |The Times of India Group |В Plot No. 8-11, Techzone-II, Greater Noida.M: 9740616134В ,Web: www.bennett.edu.in",https://outlook.office365.com/owa/?ItemID=AAMkAGY5Y2ZkY2U1LTZkMDAtNDdmMS1iN2YyLWRkYmRhYjljMGIyZQBGAAAAAAA1acH4l31PT5bYjWIdT7j8BwD0di2GbE5eQLmNvaC7hxKrAAAAAAEMAAD0di2GbE5eQLmNvaC7hxKrAALbsEWiAAA%3D&exvsurl=1&viewmodel=ReadMessageItem,Naushad.H@bennett.edu.in,AAMkAGY5Y2ZkY2U1LTZkMDAtNDdmMS1iN2YyLWRkYmRhYjljMGIyZQBGAAAAAAA1acH4l31PT5bYjWIdT7j8BwD0di2GbE5eQLmNvaC7hxKrAAAAAAEMAAD0di2GbE5eQLmNvaC7hxKrAALbsEWiAAA=
